_id,mongoId,avettaId,mongoObject,field,formDisplayId,questionGroupType,en
694e58cc0100004d003f9076,57fe79415049431b1c14ca98,9700,questionGroup,questionGroupText,20232,form,Peru
694e58e301000044003f9078,5ae8d8932400008a0091f9a1,20232,questionGroup,questionGroupText,20232,form,Avetta Peru Annual Update
57fe786650494391343d637e,,41265,question,description,20232,form,"IMPORTANT: Please make sure to include all Full-Time, Part-Time, Seasonal, and Contract workers under your supervision, even if they were not under your direct employment."
57fe786650494391343d637e,,41265,question,questionText,20232,form,Please enter the Average Number of Employees your company had during the given year:
57fe7881504943cb7dcc8024,,41266,question,description,20232,form,"Workplace accident: Any sudden event that occurs due to or in connection with work, which causes an organic injury, functional disturbance, disability, or death to the worker. An accident at work is also one that occurs during the execution of orders from the employer, or during the execution of a task under his authority, and even outside the workplace and hours of work.\n\nDepending on their severity, workplace accidents with personal injuries can be:\n\n1 . Minor Accident: an event whose injury, as a result of the medical evaluation, generates in the injured party a short rest with maximum return the next day to their usual work.\n\n2 . Disabling Accident: an event whose injury, as a result of the medical evaluation, gives place of rest, justified absence from work, and treatment. For statistical purposes, it will not be taken into account on the day of the accident.\n\nAccording to the degree of disability, accidents at work can be:\n\n2.1 . Total Temporary: when the injury makes it impossible for the injured party to use their body, medical treatment will be granted up to their full recovery.\n2.2 . Partial Permanent: when the injury results in the partial loss of a limb or organ or of the functions of the same.\n2.3 . Total Permanent: when the injury generates the total anatomical or functional loss of a member or organ, or of the functions of the same. It is considered due to the loss of the little finger.\n\n3 . Fatal accident: An event in which injuries cause the death of the worker. For statistical purposes, the date of death must be considered.\n\nAn incident is an event that occurs in the course of work or in connection with work, in which the affected person does not suffer bodily injury or in which the injury requires only first aid care.\n\nDangerous incident: Any potentially risky event that could cause injuries or illnesses to people at work or to the population.\n\nProfessional or occupational disease: An illness contracted as a result of exposure to risk factors related to work.\n\nAll Work Accidents (No. 1, 2, and 3) and Dangerous Incidents must be registered under Article 87 of Law 29783.\n\nAll Work Accidents (No. 1, 2, and 3), Dangerous Incidents and Incidents must be registered under Article 33 of Supreme Decree No. 005-2012-TR.\n\nWorkers who do not truthfully report accidents, incidents, or occupational diseases to public bodies may be criminally denounced under Article 79 i) of Law 29783.\n\nEmployers (employers) report (to the labor authority) Fatal Work Accidents and Dangerous Incidents. Medical care centers notify (to the labor authority) Occupational accidents (No. 1 and 2) and occupational diseases. All this by virtue of Article 110 of Supreme Decree No. 005-2012-TR."
57fe7881504943cb7dcc8024,,41266,question,questionText,20232,form,"Did your company record/report any workplace accidents, occupational diseases, or specified dangerous occurrences (near misses)?"
57fe7881504943cb7dcc8024,,41266,question,responseOptionNo,20232,form,No
57fe7881504943cb7dcc8024,,41266,question,responseOptionYes,20232,form,Yes
57fe79d750494332ee48a7a9,,41267,question,description,20232,form,"Include hours worked by salaried, hourly, part-time and seasonal workers including temporary help services workers under your supervision, even if they were not under your direct employment.\nDo not include vacation, sick leave, holidays, or any other non-work time, even if employees were paid for it. If your establishment keeps records of only the hours paid or if you have employees who are not paid by the hour, please estimate the hours that the employees actually worked. If this number isn't available, an estimate is still needed."
57fe79d750494332ee48a7a9,,41267,question,questionText,20232,form,Please enter the total number of hours worked by all employees during the given year. Please round your answer to the next highest whole number.
57fe7aaf50494368f7e1fbbe,,41268,question,description,20232,form,Fatal accident: An event in which injuries cause the death of the worker.
57fe7aaf50494368f7e1fbbe,,41268,question,questionText,20232,form,Please enter the total number of fatal accidents for the given year:
57fe7ab7504943e2a99dcb21,,41270,question,description,20232,form,"Medical leave: Period of physical or mental rest prescribed by the treating physician, necessary for the patient to achieve physical and mental recovery that allows for full recovery; it does not mean incapacity for work.\n\nhttps://www.essalud.gob.pe/certificados-de-incapacidad/\nSocial Health Insurance, Reference concepts, page 15"
57fe7ab7504943e2a99dcb21,,41270,question,questionText,20232,form,Please enter the total number of days away from work
5df3d401350000fecba1dba4,,89610,question,questionText,20232,form,"### High Work Hours:\n\nAre your hours and/or employee count entered correctly? The total number of hours reported are considerably *HIGHER* than the average annual hours typically worked by full-time employees.\n\nPlease validate that you have entered your correct employee count and/or total hours. If correct, provide a brief explanation for approval (this will be visible to your client connections). Otherwise, please correct your answers."
5df3d41b330000eb4995fb75,,89613,question,questionText,20232,form,"### Low Work Hours:\n\nAre your hours and/or employee count entered correctly? The total number of hours reported are considerably *LOWER* than the average annual hours typically worked by full-time and part-time employees.\n\nPlease validate that you have entered your correct employee count and/or total hours. If correct, provide a brief explanation for approval (this will be visible to your client connections). Otherwise, please correct your answers."
657ce68c1a00008c2d7a47ad,,148413,question,description,20232,form,"Total Permanent incapacitating accident: When the injury causes the total anatomical or functional loss of a limb or organ, or of its functions. It is considered as such since the loss of the little finger."
657ce68c1a00008c2d7a47ad,,148413,question,questionText,20232,form,Please enter the total number of Permanent workplace incapacitating accidents for the given year:
657ce6a71a00005b377a47ae,,148414,question,description,20232,form,Partial Permanent: When the injury causes the partial loss of a limb or organ or its functions.
657ce6a71a00005b377a47ae,,148414,question,questionText,20232,form,Please enter the total number of Partial Permanent Incapacitating workplace accidents for the given year:
657ce6bd1a00005f377a47b0,,148415,question,description,20232,form,"Temporary Total: When the injury causes the injured person to be unable to use his or her body, medical treatment will be provided until full recovery."
657ce6bd1a00005f377a47b0,,148415,question,questionText,20232,form,Please enter the total number of Temporary Total Incapacitating workplace accidents for the given year:
657ce8f31700009234796e8c,,148416,question,description,20232,form,"Minor accident: An event in which the injury, as a result of a medical evaluation, causes the injured person to take a short break and return to their normal work the following day at most."
657ce8f31700009234796e8c,,148416,question,questionText,20232,form,Please enter the total number of minor accidents for the given year:
657ce9051a00008c2d7a47b3,,148417,question,description,20232,form,An illness contracted as a result of exposure to risk factors related to work.
657ce9051a00008c2d7a47b3,,148417,question,questionText,20232,form,Please enter the total number of Occupational Diseases/Illnesses for the given year:
69264c030100006700be9829,,189537,question,description,20232,form,"An incident is an event that occurs in the course of work or in connection with work, in which the affected person does not suffer bodily injury or in which the injury requires only first aid care."
69264c030100006700be9829,,189537,question,questionText,20232,form,Please enter the total number of first aid incidents for the given year:
69264e970100006500ff3fe2,,189538,question,description,20232,form,Dangerous incident: Any potentially risky event that could cause injuries or illnesses to people at work or to the population.
69264e970100006500ff3fe2,,189538,question,questionText,20232,form,Please enter the total number of dangerous incidents (dangerous occurrences) for the given year:
