_id,mongoId,avettaId,mongoObject,field,formDisplayId,questionGroupType,en
680fe6680100007a00960183,680fc594010000c3005decd1,45550,questionGroup,description,45550,form,This requirement is triggered because you indicated your organization maintains a valid Chinese Enterprise Production Permit in the Chinese Enterprise Safety Production Permit questionnaire.
680fe6680100007a00960183,680fc594010000c3005decd1,45550,questionGroup,questionGroupText,45550,form,Chinese Enterprise Safety Production Permit
680fc64d010000c2005decd7,,169088,question,description,45550,form,"The Chinese Enterprise Health and Safety Production Permit is an official license required for certain high-risk industries in China, mining, construction, hazardous chemicals, fireworks, and explosives manufacturing. The permit certifies that an enterprise meets national standards for workplace safety and health before beginning or continuing production.\n\n<a href=""https://www.gov.cn/banshi/2005-07/12/content_13716.htm""target=""_blank"">Obtaining a Chinese Enterprise Safety Production Permit</a> \n<a href=""https://banshi.beijing.gov.cn/pubtask/download/0c24fa5d-2153-4e3f-924c-4dbc3608f899.jpg""target=""_blank"">Sample of Safety Production Permit</a>"
680fc64d010000c2005decd7,,169088,question,questionText,45550,form,Please upload your Chinese Enterprise Safety Production Permit:
680fc720010000c1005dece3,,169089,question,description,45550,form,"<a href=""https://banshi.beijing.gov.cn/pubtask/download/0c24fa5d-2153-4e3f-924c-4dbc3608f899.jpg""target=""_blank"">Sample of Safety Production Permit</a> "
680fc720010000c1005dece3,,169089,question,questionText,45550,form,Please enter the issue date of your Chinese Enterprise Safety Production Permit:
680fc73b0100003e005deced,,169090,question,description,45550,form,"The permit is valid for <a href=""https://www.gov.cn/banshi/2005-07/12/content_13716.htm""target=""_blank"">three years</a> from the issue date. Please enter the expiration date as exactly three years after the issue date."
680fc73b0100003e005deced,,169090,question,questionText,45550,form,Please enter the expiration date of your Chinese Enterprise Safety Production Permit:
