_id,mongoId,avettaId,mongoObject,field,formDisplayId,questionGroupType,en
6952d94e0100006100203ba7,692e09470100006400d29a2f,49260,questionGroup,description,49260,form,This requirement is triggered because you indicated your organization maintains a valid Spain Chamber of Commerce Certification in the Spain Chamber of Commerce Certification Applicability Assessment.
6952d94e0100006100203ba7,692e09470100006400d29a2f,49260,questionGroup,questionGroupText,49260,form,Spain Chamber of Commerce Certificate
692e09470100004700d29a30,,189560,question,description,49260,form,"The Spain Chamber of Commerce Certificate is an official document issued by the competent territorial Chamber of Commerce that certifies that a business appears in the Chamber’s public business census. It usually states details such as a company’s identification details, tax ID, registered address, and economic activity.\n<b></b>\nUnder <a href=""https://www.boe.es/buscar/act.php?id=BOE-A-2014-3520"" target=""_BLANK_"">Law 4 on the Basic Law of the Official Chambers of Commerce, Industry, Services, and Navigation</a>, businesses that carry out commercial, industrial, service or shipping activities in Spain are automatically included in the relevant Chamber’s census.\n<b></b>\nThis certificate does not replace company incorporation or mercantile-registry documentation and does not by itself prove legal incorporation; instead, it confirms your business data as recorded in the Chamber’s public census on the date of issue, for use with authorities, customers or partners that require it.\n<b></b>\n <a href=""https://www.boe.es/buscar/doc.php?id=BOE-A-2015-8049"" target=""_BLANK_"">Royal Decree 669</a>\n<p></p>\n <a href=""https://www.comercio.gob.es/ComercioInterior/Camaras/Paginas"" target=""_BLANK_"">Statutory norms issued by regional governments or the Ministry of Industry, Trade and Tourism</a>.\n"
692e09470100004700d29a30,,189560,question,questionText,49260,form,Please upload your Spain Chamber of Commerce Certification.
692e0b190100006100319791,,189561,question,questionText,49260,form,Please enter the issue date of your  Spain Chamber of Commerce Certification.
692e0b310100004500d29a43,,189562,question,description,49260,form,Please enter the expiration date as one year after the issue date.
692e0b310100004500d29a43,,189562,question,questionText,49260,form,Please enter the expiration date of your Spain Chamber of Commerce Certification.
