_id,mongoId,avettaId,mongoObject,field,formDisplayId,questionGroupType,en
692f77f40100003e00b5936c,692e1c310100006200d29cd8,49262,questionGroup,description,49262,form,This requirement is triggered because you indicated your organization maintains a valid COA Process Piping Installation ASME B31.3 (Shop & Field) in the Canada COA Applicability Assessment questionnaire.
692f77f40100003e00b5936c,692e1c310100006200d29cd8,49262,questionGroup,questionGroupText,49262,form,Avetta PQF - Canada COA Process Piping Installation ASME B31.3 (Shop & Field)
692e1c7901000045003198c8,,189566,question,description,49262,form,"The Certificate of Authorization (COA), issued by the Technical Standards and Safety Authority (TSSA) in Ontario, Canada, is a regulatory license required for organizations performing activities under the province’s <a href=""https://www.ontario.ca/laws/statute/00t16"">Technical Standards and Safety Act, 2000</a> and <a href=""https://www.ontario.ca/laws/regulation/010220#BK4"">O. Reg. 220/01: Boilers and Pressure Vessels</a>. Companies which design, manufacture, assemble, repair, or alter pressure equipment (e.g., boilers, pressure vessels, fittings) are required to maintain this certificate. \n\nA company can obtain a digital copy of its Certificate(s) of Authorization (COA) directly through the Technical Standards and Safety Authority (TSSA) <a href=""https://www.tssa.org/tssa-portals"">Client Portal</a>. "
692e1c7901000045003198c8,,189566,question,questionText,49262,form,Please upload your COA Process Piping Installation ASME B31.3 (Shop & Field).
692e1d910100004900d29ce5,,189567,question,description,49262,form,
692e1d910100004900d29ce5,,189567,question,questionText,49262,form,Please enter the expiration date of your COA Process Piping Installation ASME B31.3 (Shop & Field).
