_id,mongoId,avettaId,mongoObject,field,formDisplayId,questionGroupType,en
67781cac0100003b00554d3d,5fc69d922a0000124bcb61b4,32048,questionGroup,questionGroupText,32048,form,Brazil Fire Department Inspection Report
674d5e430100002f001711c0,5fc69da52a00006f88f7f5e0,32049,questionGroup,questionGroupText,32048,form,Brazil Fire Department Inspection Report
5fc69dd82a00006f88f7f5f5,,104791,question,questionText,32048,form,Sign below to confirm  the uploaded document is correct and updated.\n
674ded8f0100007000a40d8b,,162503,question,questionText,32048,form,Please upload the Fire Department Inspection Report (AVCB).\n
674deda30100003200a40d8c,,162504,question,questionText,32048,form,Expiration Date:\n
